### ISSUE TITLE
Abnormal traffic in links

### ISSUE THREAD

**Issue by LasiX** [angt/glorytun#39]
Hi All,

I've tested glorytun on one of my devices with debian 8 (client) and the server is debian 9.
When it gets connected starts to send traffic on both ways saturating the uplinks and creating high latency. I have one LTE (sierra-2-0) +  WIFI (ath-1-1-00) interfaces. 

Libsodium is 1.0.11-2 on both.

Server:
DEV=tun0
HOST=213.XX.XXX.69
PORT=5000
BIND=0.0.0.0
BIND_PORT=5000
OPTIONS=

Client:
DEV=tun-1-0
HOST=213.XX.XXX.69
PORT=5000
BIND=0.0.0.0
BIND_PORT=5000
OPTIONS=

dstat -n -N sierra-2-0,ath-1-1-00
net/sierra--net/ath-1-1
 recv  send: recv  send
   0     0 :   0     0
 623k  620k:1514B 3216B
 671k  674k:  10k   14k
 889k  891k:4602B 6136B
 938k  938k:  12k   15k
 875k  876k:7630B   10k
 848k  850k:9084B   11k
 741k  743k:  12k   17k
 970k  970k:1514B 3068B
 977k  980k:6056B 9360B
 792k  793k:  12k   15k
 794k  795k:6130B 9827B
 825k  825k:9084B   12k
 740k  743k:  12k   13k
 853k  854k:  10k   14k
 861k  861k:  10k   12k
 832k  832k:  13k   15k
 872k  873k:9084B   11k
 768k  766k:  13k   15k
 809k  812k:7570B 9204B
 853k  854k:  12k   15k
 876k  877k:  10k   12k
 
 
18:59:20.086038 IP 172.18.100.19.5000 > bbottsv.5000: UDP, length 1472
18:59:20.193015 IP bbottsv.5000 > 172.18.100.19.5000: UDP, length 1472
18:59:20.193525 IP 172.18.100.19.5000 > bbottsv.5000: UDP, length 1472
18:59:20.290387 IP bbottsv.5000 > 172.18.100.19.5000: UDP, length 1472
18:59:20.290854 IP 172.18.100.19.5000 > bbottsv.5000: UDP, length 1472
18:59:20.341563 IP bbottsv.5000 > 172.18.100.19.5000: UDP, length 1472
18:59:20.342000 IP 172.18.100.19.5000 > bbottsv.5000: UDP, length 1472
18:59:20.446314 IP bbottsv.5000 > 172.18.100.19.5000: UDP, length 1472
18:59:20.446763 IP 172.18.100.19.5000 > bbottsv.5000: UDP, length 1472
18:59:20.525617 IP bbottsv.5000 > 172.18.100.19.5000: UDP, length 1472
18:59:20.526087 IP 172.18.100.19.5000 > bbottsv.5000: UDP, length 1472

Kind Regards,
LasiX

**Comment by angt** [comment]
Hi,
Could you also send the output of the command `glorytun path` on both side ?

**Comment by angt** [comment]
Also by default, the script `glorytun-setup` setup a symmetric path of 100Mbps. It is not adapted for multipath setup.

**Comment by LasiX** [comment]
Hi angt,

Thank you for your reply.
As requested here goes the commands. Regarding multipath I've setup the ppp/ip-up.d to deal with the path.
I cannot find the source of this traffic, and with LTE connections the quota exhaust fast at this rhythm.


net/sierra--net/sierra--net/ath-1-1
 recv  send: recv  send: recv  send
   0     0 :   0     0 :   0     0
 543k  542k:1483k 1469k:  15k   15k
 542k  544k:1208k 1213k:  33k   34k
 520k  522k:1063k 1066k:  41k   43k
 527k  527k:1229k 1230k:  44k   48k
 532k  533k:1121k 1119k:  40k   40k
 532k  533k:1096k 1096k:  58k   60k^C


root@SERVER1:/home/user# glorytun path
path UP
  status:   OK
  bind:     213.XXX.XXX.69 port 5000
  public:   213.XXX.XXX.69 port 5000
  peer:     213.XXX.XXX.66 port 5000
  mtu:      1472 bytes
  rtt:      586.786 ms
  rttvar:   82.319 ms
  rate tx:  75000000 bytes/sec
  rate rx:  0 bytes/sec
  total tx: 6806 packets
  total rx: 7024 packets
path UP
  status:   OK
  bind:     213.XXX.XXX.69 port 5000
  public:   213.XXX.XXX.69 port 5000
  peer:     89.XXX.XXX.147 port 5000
  mtu:      1472 bytes
  rtt:      217.700 ms
  rttvar:   3.537 ms
  rate tx:  75000000 bytes/sec
  rate rx:  0 bytes/sec
  total tx: 71989 packets
  total rx: 71700 packets
path UP
  status:   OK
  bind:     213.XXX.XXX.69 port 5000
  public:   213.XXX.XXX.69 port 5000
  peer:     89.XXX.XXX.121 port 5000
  mtu:      1472 bytes
  rtt:      236.754 ms
  rttvar:   4.247 ms
  rate tx:  75000000 bytes/sec
  rate rx:  0 bytes/sec
  total tx: 4458 packets
  total rx: 4422 packets




root@CLIENT52:/home/user# glorytun path
path UP
  status:   OK
  bind:     172.18.100.19 port 5000
  public:   213.XXX.XXX.66 port 5000
  peer:     213.XXX.XXX.69 port 5000
  mtu:      1472 bytes
  rtt:      420.268 ms
  rttvar:   16.802 ms
  rate tx:  75000000 bytes/sec
  rate rx:  75000000 bytes/sec
  total tx: 7125 packets
  total rx: 6439 packets
path UP
  status:   OK
  bind:     89.XXX.XXX.147 port 5000
  public:   89.XXX.XXX.147 port 5000
  peer:     213.XXX.XXX.69 port 5000
  mtu:      1472 bytes
  rtt:      264.375 ms
  rttvar:   6.637 ms
  rate tx:  75000000 bytes/sec
  rate rx:  75000000 bytes/sec
  total tx: 68934 packets
  total rx: 68596 packets
path UP
  status:   OK
  bind:     89.XXX.XXX.121 port 5000
  public:   89.XXX.XXX.121 port 5000
  peer:     213.XXX.XXX.69 port 5000
  mtu:      1472 bytes
  rtt:      252.121 ms
  rttvar:   3.080 ms
  rate tx:  75000000 bytes/sec
  rate rx:  75000000 bytes/sec
  total tx: 3205 packets
  total rx: 3160 packets

**Comment by angt** [comment]
Your setup looks good, you don't have traffic on the glorytun interface but still see udp port 5000 packets ?

**Comment by LasiX** [comment]
The problem here is that glorytun keeps exchanging UDP packets generation a lot of traffic in the interfaces even when I'm not doing any traffic causing latency on the links.
i.e.:
rtt: 252.121 ms
rtt: 264.375 ms
rtt: 420.268 ms

13:51:14.594857 IP 172.18.100.19.5000 > bbottsv.5000: UDP, length 1469
13:51:14.675644 IP bbottsv.5000 > 172.18.100.19.5000: UDP, length 1468
13:51:14.676100 IP 172.18.100.19.5000 > bbottsv.5000: UDP, length 1468
13:51:14.781325 IP bbottsv.5000 > 172.18.100.19.5000: UDP, length 1469
13:51:14.781784 IP 172.18.100.19.5000 > bbottsv.5000: UDP, length 1469
13:51:15.056894 IP bbottsv.5000 > 172.18.100.19.5000: UDP, length 1469

**Comment by angt** [comment]
Yes, I'm going to reproduce your case and see whats happening. Do you use 0.1.2 ?

**Comment by LasiX** [comment]
root@SHAWTS1:/home/user# glorytun version
0.1.1

**Comment by LasiX** [comment]
I will create 2 vms just with glorytun installed and check if I can replicate.

**Comment by angt** [comment]
I have a 3 path setup with high latency as yours:
```$ sudo ./glorytun path dev glorytun-client
path UP
  status:   OK
  bind:     10.10.1.1 port 5000
  public:   10.10.1.1 port 5000
  peer:     10.166.0.1 port 5000
  mtu:      1472 bytes
  rtt:      227.613 ms
  rttvar:   14.345 ms
  rate tx:  112500 bytes/sec
  rate rx:  2250000 bytes/sec
  total tx: 12139 packets
  total rx: 27708 packets
path UP
  status:   OK
  bind:     10.10.2.1 port 5000
  public:   10.10.2.1 port 5000
  peer:     10.166.0.1 port 5000
  mtu:      1472 bytes
  rtt:      425.669 ms
  rttvar:   13.228 ms
  rate tx:  112500 bytes/sec
  rate rx:  2250000 bytes/sec
  total tx: 12315 packets
  total rx: 27709 packets
path UP
  status:   OK
  bind:     10.10.3.1 port 5000
  public:   10.10.3.1 port 5000
  peer:     10.166.0.1 port 5000
  mtu:      1472 bytes
  rtt:      219.287 ms
  rttvar:   5.642 ms
  rate tx:  112500 bytes/sec
  rate rx:  2250000 bytes/sec
  total tx: 12168 packets
  total rx: 27824 packets
```
but without traffic i have nothing:
```
$ sudo timeout 10 tcpdump -i any udp port 5000
tcpdump: verbose output suppressed, use -v or -vv for full protocol decode
listening on any, link-type LINUX_SLL (Linux cooked), capture size 262144 bytes

0 packets captured
0 packets received by filter
0 packets dropped by kernel
```

**Comment by LasiX** [comment]
So if the system have some kind of traffic like SNMP is always sending UDP packets with maximum size (MTU)?

**Comment by angt** [comment]
Yes,
only when there is traffic, glorytun adds some big packets to keep track of the path status (checking MTU in the same time) in both directions.

**Comment by LasiX** [comment]
angt,

Thank you for clearing this, I thing the solution is in the correct path but this is very limitative to use in mobile networks because will increase the traffic a lot, also in slow connections will cause for sure delays due to high latency.
If you have some kind of hearthbeat solution that is residual traffic will cause a huge send of large packets.

**Comment by angt** [comment]
Yes, mud traffic should be always < 120kbps.
I'll work on that part to reduce it.

**Comment by LasiX** [comment]
Thank you angt.

I think we can close this issue 👍 .
